{
  "budget": {
    "recommended_daily_items": 10
  },
  "component_schema_versions": {
    "collection": 1,
    "profile": 2,
    "source": 2
  },
  "count": 32,
  "profile": {
    "boost": {
      "topics": [
        "startup",
        "product",
        "ai"
      ],
      "traits": []
    },
    "budget": {
      "recommended_daily_items": 10
    },
    "collections": [
      "essential",
      "ai",
      "company-engineering"
    ],
    "description": "Technical product and company-building coverage combining durable engineering, AI, product, startup, and production-system sources.",
    "exclude": {
      "sources": [],
      "topics": [],
      "traits": [
        "release-notes"
      ]
    },
    "id": "founder",
    "name": "Technical Founder",
    "schema_version": 2
  },
  "registry_schema_version": 2,
  "resolution": {
    "candidate_count": 34,
    "exclude_precedence": "exclude-before-boost",
    "excluded_count": 2,
    "ordering": "boost-score-desc-then-first-appearance",
    "selected_count": 32
  },
  "schema_version": 1,
  "sources": [
    {
      "matched_boost_topics": [
        "startup",
        "product"
      ],
      "matched_boost_traits": [],
      "priority_score": 2,
      "source": {
        "curation": {
          "admission_basis": [
            "first-party-engineering"
          ],
          "rationale": "Admitted for first-party engineering and technical analysis spanning APIs, infrastructure, programming, product systems, reliability, and developer experience.",
          "review_after": "2026-12-19",
          "reviewed_at": "2026-09-20",
          "reviewer": "GeoGeekLab"
        },
        "description": "First-party technical publication covering programming, infrastructure, product, startup.",
        "feeds": [
          {
            "format": "rss",
            "official": true,
            "role": "primary",
            "url": "https://stripe.com/blog/feed.rss"
          }
        ],
        "id": "stripe-blog",
        "kind": "company",
        "language": "en",
        "name": "Stripe Blog",
        "provenance": {
          "added_at": "2026-09-20",
          "added_by": "GeoGeekLab",
          "evidence": [
            {
              "note": "Canonical source home page.",
              "type": "identity",
              "url": "https://stripe.com/blog"
            },
            {
              "note": "Primary subscription endpoint published by the source.",
              "type": "feed",
              "url": "https://stripe.com/blog/feed.rss"
            }
          ]
        },
        "registry_path": "sources/companies/stripe-blog.yaml",
        "schema_version": 2,
        "status": "active",
        "topics": [
          "programming",
          "infrastructure",
          "product",
          "startup"
        ],
        "traits": [
          "first-party",
          "company-engineering",
          "analysis"
        ],
        "website": "https://stripe.com/blog"
      }
    },
    {
      "matched_boost_topics": [
        "startup",
        "ai"
      ],
      "matched_boost_traits": [],
      "priority_score": 2,
      "source": {
        "curation": {
          "admission_basis": [
            "technical-community"
          ],
          "rationale": "Admitted as a broad technical discovery community whose feed surfaces engineering, startup, AI, and security discussions that can reveal sources outside the curated registry.",
          "review_after": "2026-12-19",
          "reviewed_at": "2026-09-20",
          "reviewer": "GeoGeekLab"
        },
        "description": "Technical community feed covering programming, startup, ai, security.",
        "feeds": [
          {
            "format": "rss",
            "official": false,
            "role": "primary",
            "url": "https://hnrss.org/frontpage"
          }
        ],
        "id": "hacker-news",
        "kind": "community",
        "language": "en",
        "name": "Hacker News",
        "provenance": {
          "added_at": "2026-09-20",
          "added_by": "GeoGeekLab",
          "evidence": [
            {
              "note": "Canonical source home page.",
              "type": "identity",
              "url": "https://news.ycombinator.com/"
            },
            {
              "note": "Primary subscription endpoint used by the registry.",
              "type": "feed",
              "url": "https://hnrss.org/frontpage"
            }
          ]
        },
        "registry_path": "sources/communities/hacker-news.yaml",
        "schema_version": 2,
        "status": "active",
        "topics": [
          "programming",
          "startup",
          "ai",
          "security"
        ],
        "traits": [
          "community",
          "high-frequency"
        ],
        "website": "https://news.ycombinator.com/"
      }
    },
    {
      "matched_boost_topics": [
        "ai"
      ],
      "matched_boost_traits": [],
      "priority_score": 1,
      "source": {
        "curation": {
          "admission_basis": [
            "independent-practitioner"
          ],
          "rationale": "Admitted for high-frequency independent practitioner writing connecting AI, language models, Python, databases, and the web with reproducible technical detail.",
          "review_after": "2026-12-19",
          "reviewed_at": "2026-09-20",
          "reviewer": "GeoGeekLab"
        },
        "description": "Independent technical writing covering ai, llm, python, databases, web.",
        "feeds": [
          {
            "format": "atom",
            "official": true,
            "role": "primary",
            "url": "https://simonwillison.net/atom/everything/"
          }
        ],
        "id": "simon-willison",
        "kind": "individual",
        "language": "en",
        "name": "Simon Willison’s Weblog",
        "provenance": {
          "added_at": "2026-09-20",
          "added_by": "GeoGeekLab",
          "evidence": [
            {
              "note": "Canonical source home page.",
              "type": "identity",
              "url": "https://simonwillison.net/"
            },
            {
              "note": "Primary subscription endpoint published by the source.",
              "type": "feed",
              "url": "https://simonwillison.net/atom/everything/"
            }
          ]
        },
        "registry_path": "sources/individuals/simon-willison.yaml",
        "schema_version": 2,
        "status": "active",
        "topics": [
          "ai",
          "llm",
          "python",
          "databases",
          "web"
        ],
        "traits": [
          "original",
          "practitioner",
          "deep-dive",
          "independent",
          "high-frequency"
        ],
        "website": "https://simonwillison.net/"
      }
    },
    {
      "matched_boost_topics": [
        "ai"
      ],
      "matched_boost_traits": [],
      "priority_score": 1,
      "source": {
        "curation": {
          "admission_basis": [
            "primary-research"
          ],
          "rationale": "Admitted as a first-party frontier AI research source covering language models, safety, and research engineering, providing primary material rather than secondary reporting.",
          "review_after": "2026-12-19",
          "reviewed_at": "2026-09-20",
          "reviewer": "GeoGeekLab"
        },
        "description": "Primary research and research-engineering source covering ai, llm, research, security.",
        "feeds": [
          {
            "format": "rss",
            "official": true,
            "role": "primary",
            "url": "https://www.anthropic.com/rss.xml"
          }
        ],
        "id": "anthropic",
        "kind": "research",
        "language": "en",
        "name": "Anthropic",
        "provenance": {
          "added_at": "2026-09-20",
          "added_by": "GeoGeekLab",
          "evidence": [
            {
              "note": "Canonical source home page.",
              "type": "identity",
              "url": "https://www.anthropic.com/research"
            },
            {
              "note": "Primary subscription endpoint published by the source.",
              "type": "feed",
              "url": "https://www.anthropic.com/rss.xml"
            }
          ]
        },
        "registry_path": "sources/research/anthropic.yaml",
        "schema_version": 2,
        "status": "active",
        "topics": [
          "ai",
          "llm",
          "research",
          "security"
        ],
        "traits": [
          "first-party",
          "research",
          "deep-dive"
        ],
        "website": "https://www.anthropic.com/research"
      }
    },
    {
      "matched_boost_topics": [
        "ai"
      ],
      "matched_boost_traits": [],
      "priority_score": 1,
      "source": {
        "curation": {
          "admission_basis": [
            "primary-research"
          ],
          "rationale": "Admitted as a first-party AI research source spanning frontier models, machine learning, scientific applications, and research methodology.",
          "review_after": "2026-12-19",
          "reviewed_at": "2026-09-20",
          "reviewer": "GeoGeekLab"
        },
        "description": "Primary research and research-engineering source covering ai, machine-learning, research.",
        "feeds": [
          {
            "format": "rss",
            "official": true,
            "role": "primary",
            "url": "https://deepmind.google/blog/rss.xml"
          }
        ],
        "id": "google-deepmind",
        "kind": "research",
        "language": "en",
        "name": "Google DeepMind",
        "provenance": {
          "added_at": "2026-09-20",
          "added_by": "GeoGeekLab",
          "evidence": [
            {
              "note": "Canonical source home page.",
              "type": "identity",
              "url": "https://deepmind.google/discover/blog/"
            },